{
  "$schema": "http://json-schema.org/draft-07/schema#",
  "$id": "https://dkg.io/agent-scope/task.schema.json",
  "title": "agent-scope Task Manifest",
  "description": "Declares what files a task may modify. See agent-scope/README.md.",
  "type": "object",
  "required": ["id"],
  "additionalProperties": false,
  "anyOf": [
    { "required": ["allowed"] },
    { "required": ["inherits"] },
    { "required": ["exemptions"] }
  ],
  "properties": {
    "id": {
      "type": "string",
      "pattern": "^[a-z0-9][a-z0-9-_.]{0,63}$",
      "description": "Task identifier. Must match the filename (without .json)."
    },
    "description": { "type": "string" },
    "owner":       { "type": "string" },
    "created":     { "type": "string", "format": "date-time" },
    "inherits": {
      "type": "array",
      "items": { "type": "string", "pattern": "^[a-z0-9][a-z0-9-_.]{0,63}$" },
      "description": "Task ids to inherit `allowed` and `exemptions` from (merged, parents first)."
    },
    "allowed": {
      "type": "array",
      "items": { "type": "string", "minLength": 1 },
      "description": "Glob patterns this task may write to. Supports *, **, ?. Prefix with ! to negate."
    },
    "exemptions": {
      "type": "array",
      "items": { "type": "string", "minLength": 1 },
      "description": "Patterns always allowed (build artifacts, lockfiles, generated files)."
    },
    "notes": { "type": "string" },
    "dkg": {
      "type": "object",
      "additionalProperties": false,
      "properties": {
        "taskUri":    { "type": "string" },
        "sessionUri": { "type": "string" }
      }
    }
  }
}
