{
  "id": "staking",
  "description": "Example: work on the staking contracts and chain adapter bindings",
  "owner": "unassigned",
  "inherits": ["base"],
  "allowed": [
    "packages/evm-module/contracts/Staking.sol",
    "packages/evm-module/contracts/StakingKPI.sol",
    "packages/evm-module/contracts/storage/StakingStorage.sol",
    "packages/evm-module/contracts/storage/DelegatorsInfo.sol",
    "packages/evm-module/contracts/storage/ConvictionStakingStorage.sol",
    "packages/evm-module/test/**staking*",
    "packages/evm-module/deploy/**staking*",
    "packages/chain/src/**staking*"
  ],
  "exemptions": [
    "**/artifacts/**",
    "**/cache/**"
  ]
}
