{
  "id": "sync-refactor",
  "description": "Example: refactor the peer sync protocol (/dkg/sync/1.0.0)",
  "owner": "unassigned",
  "inherits": ["base"],
  "allowed": [
    "packages/agent/src/**sync*",
    "packages/core/src/**sync*",
    "packages/publisher/src/**sync*",
    "packages/*/test/**sync*"
  ]
}
